{
  "actor": {
    "declared_type": "ai_agent",
    "declared_name": "Example Shopping Agent",
    "operator": "Example Consumer",
    "declared_user_agent": "ExampleShoppingAgent/1.0",
    "authentication_context": "session_cookie"
  },
  "target_surface": "checkout",
  "requested_action": "complete purchase of two restricted-delivery items",
  "asset_or_resource": "order-123",
  "decision_stage": "pre_execution",
  "dated_sources": [
    {
      "id": "ait-checkout-1",
      "source_type": "agent_identity_claim",
      "title": "Declared agent identity header",
      "date": "2026-05-28"
    },
    {
      "id": "ait-checkout-2",
      "source_type": "session_authentication_evidence",
      "title": "Authenticated checkout session",
      "date": "2026-05-28"
    },
    {
      "id": "ait-checkout-3",
      "source_type": "transaction_or_target_action_evidence",
      "title": "Order and delivery restriction summary",
      "date": "2026-05-28"
    }
  ],
  "risk_question": "Is this agent-mediated checkout ready to allow, step up, or route to human review?",
  "requested_output": "structured_json"
}
